,id,tweet,target,target_v,tema_v,target_final
1489,1.49887e+18,"Ayer, durante la sesión en que declaramos procedente la denuncia por traición a la patria del Pdte Castillo, yo advertí de la amenaza lanzada contra la congresista Rosío Torres, presidenta de la Subcomisión de Acusaciones Constitucionales. Se les sale lo terruco a estos cobardes.",NEG,NEU,-,NEG
1490,1.5103e+18,"Nota en ⁦@ExpresoPeru⁩ destacando que la Subcomisión de Acusaciones Constitucionales del ⁦@congresoperu⁩, ayer rechazó 13-0 el informe que pretendía exculpar al exministro Zamora. Ni el autor del informe votó a favor. https://t.co/Q4MgHRIXlE",NEG,NEU,-,NEG
1491,1.5238e+18,"1.- La presidente ejecutiva de una universidad pide que se haga pública una tesis (que ya de hecho debiera ser pública), por sospechas fundadas de plagio. 2.- La universidad y su dueño se niegan a cumplir. 3.- ¿Cuál debería ser el siguiente acto en esa historia?",NEG,NEU,-,NEG
1492,1.52269e+18,"Pruebas rápidas -y no PCR- para detectar virus. Mascarillas que no servían. No oxígeno. No EPP correctos. No UCI ni atención primaria. Vacuna Pfizer rechazada en 11/20 para comprar en 3/21 vacunas chinas con coima. &gt;100 mil peruanos que no debieron morir. ¿Aló Vizcarra, Sagasti? https://t.co/YBCvfPRjmp",NEG,NEG,pandemia,NEG
1493,1.53209e+18,"Abrir una Oficina de representación en Ramallah, Palestina es una pésima idea. En ⁦@ExpresoPeru⁩ de ayer. https://t.co/uHa2OJ4Qmw",NEG,NEU,-,NEG
1494,1.53205e+18,"Por Ricardo Sánchez Serra / Señor canciller, la verdad a medias es una mentira completa - La Razón https://t.co/BwzVs89m4F",NEG,NEU,-,NEG
1495,1.55263e+18,"Había confirmado, pero he decidido no asistir. - ¿cómo saludar al presidente Castillo en estas circunstancias aciagas para el Perú? - ¿cómo asistir a un desfile militar que ha vetado a los comandos Chavín de Huántar? Prefiero ver Netflix. https://t.co/Y9yxG2TR4h",NEG,NEU,-,NEG
1496,1.54949e+18,"En el evento contra el antisemitismo y la discriminación, con motivo de la conmemoración del 28 aniversario del infame atentado contra la AMIA en Buenos Aires. https://t.co/wgiQTYliO3",NEG,NEU,-,NEG
1497,1.5477e+18,"Archivo de los PRL 00224-2021-PE, 00221-2021-PE sobre Intolerancia y discriminación https://t.co/sXTHb2qFZr https://t.co/jnzaPrUQPD",NEG,NEU,-,NEG
1498,1.25695e+18,Colegas de Loreto con mucha rabia y colera recibí la partida injusta de dos colegas de Loreto a los que conocí. Y SE VAN POR FALTA DE OXIGENO!!! Mí sentido pésame a uds y las familias de los colegas fallecidos.... El @CMP_PERU en esta etapa dura los defendera siempre !!!,NEG,NEG,pandemia,NEG
1499,1.22259e+18,La flamigera carrera de @julioguzmanperu mismo Usain Bolt buscando extintor y los moretones en rostro a féminas de dirigentes de Partido le pasó factura x mas q oportunistas digan lo contrario,NEG,NEU,-,NEG
1500,1.21976e+18,Así le metan 20 kilos de Ña pancha y todas las explicaciones de connotados ex y actuales comunicadores nada limpia a Julio Guzmán y su Morado Partido,NEG,NEU,-,NEG
1501,1.2189e+18,"En el Partido Morado están cada día más Rojos, de vergüenza por sus miembros involucrados en violencia familiar y también rojazos por la identificación política de muchos de sus candidatos",NEG,NEU,-,NEG
1502,1.21851e+18,El partido morado se caracteriza por que alguno de sus líderes le hacen honor al nombre; producto de violencia familiar le ponen el ojo morado a sus cónyuges. Partido de pegalones en pleno tiempos de violencia contra la mujer!,NEG,NEU,-,NEG
1503,1.21633e+18,"Han pasado 3 semanas y no se da con autores de esta matanza de 4 valiosisimos padrillos de haras Barlovento, prensa nacional e internacional impactada x esta barbarie q golpea industria de la q dependen 20 mil familias https://t.co/DEkMCzdnMp",NEG,NEU,-,NEG
1504,1.21599e+18,"Goyo Santos, el hombre “probo”, icono de la izquierda Peruana, ex Gobernador Cajamarca, condenado a 19 años de prision x corrupción, el otrora valiente líder hoy huye cobardemente de la justicia y está NO habido.",NEG,NEU,-,NEG
1505,1.21545e+18,"Hoy Falleció el gran historiador Pablo Macera, estamos de duelo por tan importante pérdida para el Perú pero su legado permanecerá eternamente. Descansa en Paz Pablo!!",NEG,NEU,-,NEG
1506,1.21489e+18,"El Sr Abrahan Siles si le queda un atisbo de dignidad debe renunciar en el acto a pretensión de sus amigotes de meterlo x la ventana a JNJ, no ganó concurso q duró 1 año y encima con anticuchos q son envidia de Grimanesa! https://t.co/ykvER6y9Bd",NEG,NEU,-,NEG
1507,1.21384e+18,"La manipulación interesada o lobby perverso para seguir mangoneando justicia a su antojo, al descubierto en Contraloria señalan visitas de Walter Alban pidiendo no hagan preguntas difíciles a Abrahan Siles.Tanta defensa en TV no era x amor al chancho sino a los chicharrones",NEG,NEU,-,NEG
1508,1.21341e+18,El Gobernador de Arequipa al retar al Presidente de la Republica a un combate de takanakuy (lucha ancestral) revela signos claros de problemas de salud mental; urgente camisa de fuerza e internamiento en centro especializado!,NEG,NEU,-,NEG
1509,1.21291e+18,"Se repite la misma historia de Gobierno Regional de Moquegua con el mismo actor hoy Ministro Transportes Edmer Trujillo Mori, gastó 651 millones en 4 días https://t.co/nopAANYnNO",NEG,NEU,-,NEG
1510,1.23048e+18,"Ver a @Ollanta_HumalaT reclamar y quejarse dizque la persecución judicial, olvida q en su gestión hizo reabrir procesos archivados y concluidos, era el todopoderoso “comandante”. Si pretende victimización y dar pena,es todo lo contrarío da risa.",NEG,NEU,-,NEG
1511,1.22794e+18,Puede alguien como el estrenado Procurador Soria afirmar que el ex procurador adhoc Jorge Ramirez no recibió sanción; ósea la destitución no es sanción? Por favor no atentar contra la inteligencia del pueblo!!,NEG,NEU,-,NEG
1512,1.22585e+18,Falleció el Decano del Periodismo Hípico y maestro de las narraciones del Raul Serrano Arce nuestras más sentidas condolencias a su familia; a ti Raul gracias por tantas enseñanzas y todo ese apoyo al desarrollo de la hípica y su espectáculo.,NEG,NEU,-,NEG
1513,1.22468e+18,Osinergmin pagó 34 mil $ al contado para enseñarle a declarar y lavarse las manos a su Presidente Daniel Schmerler; indolencia y desatino total en lugar de ayudar a heridos y familia de 23 fallecidos. Deben destituirlo y procesarlo x malversar fondos!!,NEG,NEU,-,NEG
1514,1.23555e+18,"Hondo pesar en el Perú, falleció don Javier Pérez de Cuellar el diplomático mas prestigioso de nuestro país con larga y fructífera carrera, ex secretario general de la ONU, incomprensible e injustamente baloteado x senado en su nombramiento como embajador en Brasil. Q.E.P.D.",NEG,NEU,-,NEG
1515,1.23532e+18,El cholo sano y sagrado pretende victimización y no enfrentar a la justicia que en su momento utilizó cuando no se cansaba con su Coya de señalar: “al ladron al ladrón” al final el resultó con pruebas el peor de todos https://t.co/MLUKvAbqtD,NEG,NEU,-,NEG
1516,1.25558e+18,"Miren com nos presentan en España luego q estallara corrupción en la Policia, es vital poner a responsables tras las rejas!! https://t.co/Yhlt7lQ43O",NEG,NEU,-,NEG
1517,1.25478e+18,"En pleno estado d Emergencia por Pandemia #PNP Realiza compras escandalosas y sobrevaloradas, cuando miles de policías luchan en calles, 2 mil contagiados, 11 fallecidos , proveedores con direcciones falsas, total desprecio a la vida. @FiscaliaPeru @ContraloriaPeru Intervengan!",NEG,NEG,pandemia,NEG
1518,1.25417e+18,El martillazo debe incluir a advenedizos y oportunistas que pretenden aprovecharse de la Pandemia https://t.co/e33vGQfhNo,NEG,NEG,pandemia,NEG
1519,1.25238e+18,Ya es hora con estos irrisorios precios baje el precio de la gasolina y demás combustibles y así abaratar costo de transportes,NEG,NEU,-,NEG
1520,1.24987e+18,Muy buena reacción del Ejecutivo de anular esta compra sobrevalorada e inoperante de ventiladores para Hospital Ate. Poner e manos de la justicia a estos malos funcionarios q quisieron lucrar con la Emergencia! https://t.co/pKDfIPcJ4A,NEG,NEG,pandemia,NEG
1521,1.2497e+18,"Equipos inoperativos, vendidos al Estado a 3 veces el precio del que ya habian sido vendidos para hospital de Tacna. Componenda inaceptable en plena Emergencia Sanitaria. Ministerio Publico y Contraloria actuen de inmediato!",NEG,NEG,pandemia,NEG
1522,1.24736e+18,"Hospital Arzobispo Loayza, antaño centro asistencial referencial nacional, claustro universitario seguidor de preceptos sanitarios de su fundador Geronimo de Loayza; reportaje muestra triste abandono de autoridades https://t.co/gjc6KkdPtx",NEG,NEG,pandemia,NEG
1523,1.26345e+18,"El delito de sobrevalorar respiradores es expandido, en Bolivia detienen a más altas autoridades, acá en Ate sobrevalorados y no funcionan. Ministerio Público y Contraloria ? https://t.co/rYJueZVqdu",NEG,NEU,-,NEG
1524,1.26327e+18,"Es harto conocido los paises q imponen control de precios de las medicinas solo generan desabastecimiento y Mercado negro, hay q abastecer farmacias de puestos , centros salud y hospitales a nivel nacional y población tendrá acceso a ellos fácilmente y a precios económicos",NEG,NEG,pandemia,NEG
1525,1.26208e+18,"El populismo más irresponsabilidad se expanden y hacen más daño que virus, comprometen seriamente economía a futuro y peor aún sin encender motores de la reactivación económica https://t.co/sKoptjbkCh",NEG,NEG,pandemia,NEG
1526,1.27666e+18,"Por fin tras las rejas cayó Goyo Santos, líder de la izquierda antiminera,incurrió en delitos de colusion simple y agravada, asociacion ilícita p’ delinquir,Corrupcion x todo lado, purgará 19 años de Prision. Así quería ser Presidente!",NEG,NEG,politica,NEG
1527,1.27489e+18,"Qué tal auditorio?evocan y aplauden enérgicamente a senderistas muertos, eso quieren para el Perú? Paguen peliculon de su bolsillo derrepente ganan el Oscar https://t.co/NNoeUSvrHs",NEG,NEU,-,NEG
1528,1.27416e+18,Se atragantó con la nuez? El apellido pesa en siglo XXl?,NEG,NEU,-,NEG
1529,1.27039e+18,@AlvaroCueva18 @StevenCaldern9 Lee bien absuelto en todo,NEG,NEU,pandemia,NEG
1530,1.27037e+18,Pretender legislar para control de precios en medicamentos es harto sabido genera escasez y Mercado negro con consiguiente aumento de precios.Para eso está Indecopi en acciones contra especulación y concertación,NEG,NEU,pandemia,NEG
1531,1.26833e+18,Hoy se cumplen 31 años del criminal atentado a los soldados Húsares de Junín perpetrado por asesinos terroristas de Sendero Luminoso. Honor y gloria a nuestros valerosos Soldados!! https://t.co/QWNAAyOO6Y,NEG,NEU,-,NEG
1532,1.26756e+18,"Irrespetuoso, desleal muerde la mano de personas que le dan de comer y encima falsifica firma de Vise Presidente, lo escribe con”S” mándenlo a seguir curso de gramática y no a promocionar Cultura",NEG,NEU,-,NEG
1533,1.28818e+18,En estos momentos tan duros e ingratitud hacia Ud Presidente @albertofujimori le hacemos llegar nuestros mejores deseos en este su cumpleaños 82. Fuerza Chino!! https://t.co/Dzlcc8vt28,NEG,NEU,-,NEG
1534,1.28703e+18,"Hoy día se cumplen 20 años d “marcha de 4 Suyos” del cual Toledo se quedó con “1 Suyo”,millón $ de Soros depositado en cuenta d sobrino Koki, luego boom inmobiliario:Casas Casusrinas,Punta Sal, Camacho más 30 millones $ ECOTEVA. Festejo a farsa delictiva? Cuando lo traen? Nunca",NEG,NEU,-,NEG
1535,1.28569e+18,El gobernador de Arequipa Càceres Llica solo resultó un bravucón mediocre e incompetente que ha dejado desprotegida a su población causando dolor y muerte.,NEG,NEG,pandemia,NEG
1536,1.28392e+18,Cuando salen a lavar banderas? Están con parálisis en las manos? No les llega el Delivery de Ña-Pancha? No tienen la dirección de todos estos moralistas que pasaron por caja cobrando millones!!,NEG,NEU,-,NEG
1537,1.28339e+18,Prision preventiva a toda esta organización criminal,NEG,NEU,-,NEG
1538,1.28339e+18,"Qué tal organización criminal en la @MuniLima d alcaldesa Susana Villarán,antes veneraban colaboradores eficaces hoy q los señaló y mostró millonarias cifras d dinero q recibieron los denigran",NEG,NEU,-,NEG
1539,1.28085e+18,"La verdad va saliendo a la luz luego de 20 años; quien ordenó juzgar denuevo a terroristas? Hubo miles liberados, reducción de penas y millonarias indemnizaciones a estos asesinos. Quien reingresó Peru a la tremenda corte sin reservas? https://t.co/YMISlRcc6y",NEG,NEU,-,NEG
1540,1.27877e+18,@MarthaChavezC Nuestra más sentidas condolencias querida @MarthaChavezC estamos seguros superarás este duro momento,NEG,NEU,-,NEG
1541,1.29464e+18,"Traer un advenedizo extranjero a destruir frágil democracia y renunciar desde su país, cuantos millones se llevó?Maximiliano Aguiar: Mercedes Aráoz revela estrategia para destruir al fujimorismo - Diario ExpresoDiario Expreso https://t.co/fYYJd3kgmR",NEG,NEU,-,NEG
1542,1.29464e+18,"Nada arrancará al Fujimorismo del corazón del pueblo, en crisis económicas y epidemias ⁦@albertofujimori⁩ lideró al pueblo y solucionó los temas más álgidos para el Peru y eso no lo olvida el Pueblo. A más persecución más Fujimorismo!! https://t.co/fYYJd3kgmR",NEG,NEG,politico,NEG
1543,1.31492e+18,"El síndrome de la “Mochada” tan acentuado en gente que pregona amor al prójimo y temor de Dios, es todo lo contrario amor al bolsillo sin escrúpulos https://t.co/bLgon8wmRk",NEG,NEU,-,NEG
1544,1.33062e+18,No más judicializacion de la Política! Que hablen las Ánforas! LEY 28094 art 11-A: “NO es aplicable el proceso de suspensión de Partidos durante el proceso electoral”. Art 14: declaración de ilegalidad “la Corte Suprema de Justicia “ a pedido de Fiscal Nacion o Def. del Pueblo,NEG,NEG,politico,NEG
1545,1.32992e+18,"Dejar fuera de carrera a Fuerza Popular y ⁦@KeikoFujimori⁩ , la opinión Fiscal me parece:inconveniente e inapropiada además d inédita en proceso electoral. Contundente opinión Fernando Tuesta. Nunca más judicializar la Política !! https://t.co/ejh251RYI6",NEG,NEG,politico,NEG
1546,1.32982e+18,"Adriana Urrutia Presidenta de Transparencia se pronuncia, no es positivo para la Democracia impedir postular al Partido Fuerza Popular. No más Judicializacion de la Política !! No violemos principio democrático poder elegir y ser elegido, no más impedimentos forzados ! https://t.co/zkPwFqjBOI",NEG,NEG,politico,NEG
1547,1.32965e+18,Con claridad meridiana Señala: “Es Antidemocrático impedir que Fuerza Popular participe en elecciones”,NEG,NEG,politico,NEG
1548,1.3296e+18,@Marcos667788 @KeikoFujimori Para los q hoy señalan se cumplen 20 años de la renuncia de @albertofujimori vía Fax allí @VeroLinaresC muestra la carta con sello de recepción del Congreso traída por Edecán. Otra mentira impregnada a población 20 años!,NEG,NEU,-,NEG
1549,1.32596e+18,"Por 105 votos a favor el Congreso de la República decretó vacancia de Presidente @MartinVizcarraC , situación plena de corrupción,encubrimiento y mentiras llegó a su final",NEG,NEU,-,NEG
1550,1.34322e+18,Se esgrimen una serie de excusas para justificar no compra de vacunas aunado a un pregonero q se pasea x el Peru echándole la culpa al Congreso sin reconocer la Verdad: INCOMPETENCIA https://t.co/C3D8h53vix,NEG,NEU,-,NEG
1551,1.34193e+18,Las mentiras q repite a diario Vizcarra quitándole cuerpo a su responsabilidad en NO compra de vacunas este decreto de Urgencia lo desmiente por completo!,NEG,NEU,-,NEG
1552,1.34193e+18,"Sigue el desmadre en el País, es la realidad de este gobierno sin ninguna autoridad , envía a la Policía sin armas y recibiendo todo tipo de agresiones https://t.co/EX7WmiGAxr",NEG,NEU,-,NEG
1553,1.34153e+18,"Carreteras bloqueadas,una súper ambulancia quemada, violentistas agresivos generan daños a propiedad y caos,alentaron marchas y catalogaron de asesina a @PoliciaPeru situación incontrolable en sur y norte, Partido Morado mucho verso sin principio de autoridad",NEG,NEU,-,NEG
1554,1.34085e+18,Contundente aclaración de Sr. Jaime Reusche sobre responsabilidad ex Presidente Martin Vizcarra y el Ejecutivo desmintiéndolo sobre q vacancia impidió compra de vacunas. Incompetencia pura! https://t.co/Hkvj3HVNdh,NEG,NEU,-,NEG
1555,1.33975e+18,"Documento que muestra los extremos a que llegan la propuesta inconsistente que resulta en incompetencia extrema, resultado 0 vacunas https://t.co/Tsf6hdBlw0",NEG,NEU,-,NEG
1556,1.33938e+18,Con un mensaje tan soporífero el Ministro ha prometido despertar cuando compren las vacunas!,NEG,NEU,-,NEG
1557,1.33882e+18,"En @MininterPeru a través de dirección Gobierno interior y gente del Hno. de Senderistas pretenden controlar elecciones, en esta encuesta q solo ellos manejan hay triple empate en 1er lugar y el Arquero luego de varios bloopers ha caído feo!",NEG,NEU,-,NEG
1558,1.33867e+18,"Poner una escenografía llena de Morado, cuánto cuesta? Claro peculado de uso en plena pandemia y no hay para comprar vacunas. Que no le tiemble la mano para parar este despropósito y encima con fondos públicos! https://t.co/SYloONtiEg",NEG,NEU,-,NEG
1559,1.33775e+18,"Ese currículum es un prontuario y así permanece en el puesto? El reportaje fue devastador, tráfico de drogas sin el mínimo control, compra de grilletes electrónicos ídem, impunidad y desgobierno!",NEG,NEU,-,NEG
1560,1.33715e+18,Fuerza Popular a nivel nacional exige derecho democrático a elegir y ser elegido. Alto a la judializacion de la Política. https://t.co/kU1LF5hluM,NEG,NEU,-,NEG
1561,1.33704e+18,"El Partido Morado resultó más rojo q el rocoto, campeones de la repartija pero pésimos en conducción gubernamental, País incendiándose y desgobierno incontrolable!! Churchill dijo esta realidad q dura hasta hoy https://t.co/q5IKF285GO",NEG,NEU,-,NEG
1562,1.33686e+18,"Una pena, tremendo jugador !!",NEG,NEU,-,NEG
1563,1.33668e+18,"Constitución art. 122 “El Presidente nombra o remueve los Ministros a propuesta y acuerdo del Premier”, cuando reconoce fue equivocación designar Min. Aliaga! No hay responsabilidad Política? Debe dar paso al costado? 3 Min. Interior en 20 días!",NEG,NEU,-,NEG
1564,1.33646e+18,"Cada vez es más grande la sensación que el País está a la deriva sin rumbo, celebramos q no le tiemble la mano pero mejor será cojee firmemente el timón y conducir, parar la violencia, castigar la destruccion de la propiedad privada y reivindicar a la @PoliciaPeru",NEG,NEU,-,NEG
1565,1.33628e+18,"8 Ministros del Interior en un año; ciencia ficción? Reforma Policial? Solo vivimos inseguridad y asaltos a mano armada, el resto es puro verso, seguiremos con @PoliciaPeru maniatada, vejada y desmoralizada!",NEG,NEU,-,NEG
1566,1.33596e+18,"Por fin un Ministro Del Interior, NO un CHICHEÑÓ. Basta de vejar a la institución tutelar de nuestra democracia y nuestra República. #YoApoyoALaPNP",NEG,NEU,-,NEG
1567,1.33521e+18,"Ausencia de temblor de mano no solo es verso se demuestra con acciones firmes y decisiones a favor del País, la inacción dejando destruyan áreas productivas tardará años en recuperarse. No más totalitarismo violento y empobrecedor!",NEG,NEU,-,NEG
1568,1.33483e+18,"Volvemos inexorablemente a épocas donde: toma tu puente, toma tu carretera y consigues lo q quieres, consecuencia tremenda violencia con una Policía vejada y maniatada. Menos Verso y Más Decisión Política!!",NEG,NEU,-,NEG
1569,1.33449e+18,"Descabezar altos mandos profesionales, satanizar e injuriar @PoliciaPeru sumado a poner Caballo de Troya en Ministerio más desbordes de violencia; todo muy bien coordinado y orquestado!! #TerrorismoNuncaMas",NEG,NEU,-,NEG
1570,1.33431e+18,Quien sorprendió al Presidente y a la Premier? Ministro del Interior confirmado es hermano de líder de la cúpula senderista Zenón Vargas. Quien responde por tanta violencia o todo es orquestado? https://t.co/fxp0AlJjAC,NEG,NEU,-,NEG
1571,1.33423e+18,Aleluya!! Renunciaron a Ministro del Interior luego de tanto maltrato a Policía Nacional aunado a violencia en Ica y sus permanentes desaciertos,NEG,NEU,-,NEG
1572,1.35524e+18,"Para seguir con su línea de conducta cuando NO? Amnistía se entromete en nuestra soberanía y favorece a violentos delincuentes!! Estos si tienen ddhh, nuestra población NO https://t.co/YyzTfq11EE",NEG,NEU,-,NEG
1573,1.35393e+18,"De espanto e incoherencia con su candidato a Presidente, Kramer VS Kramer https://t.co/7i78G5WYZc",NEG,NEU,-,NEG
1574,1.35305e+18,"No solo cambiar Constitucion 93 sino su capítulo económico planteado es reactivar Economía con emisión de dinero es decir “La Maquinita” esta herejía ha erizado la cabellera de Peruanos, será volver al pasado repasado!",NEG,NEU,-,NEG
1575,1.351e+18,"@MarthaChavezC @Cuarto_Poder Olvidas que al entrevistado el ex gerente municipal de Susana Villaran, José Miguel Castro “Budian” lo sindica en su colaboración eficaz de haberle entregado dinero de OAS",NEG,NEU,-,NEG
1576,1.3505e+18,Puro desconocimiento de la Ley https://t.co/zZI87nUxsF,NEG,NEU,-,NEG
1577,1.34868e+18,"@Marcielmarciano Así es, los q satanizaron el programa de Salud Reproductiva y Planificacion Familiar hoy Proponen el ABORTO o sea Muerte para bajar tasa Mortalidad Materna; en lugar de Educacion, Información y Planificacion Familiar",NEG,NEU,-,NEG
1578,1.34867e+18,"@canalN_ El Presidente @albertofujimori no se presentó pero sí su abogado @CesarNakazaki quien señaló NO tiene cuadernillo de Extradición, recuerdo NO se envió a Chile por q consideraron el caso estaba muy flojo carente de mérito legal",NEG,NEU,-,NEG
1579,1.3466e+18,"@VictorAscoy1 @reramirezsa @MartinVizcarraC @albertofujimori construyó más de 6 mil establecimientos del primer nivel de atención, luego del terrorismo no funcionaban ni mil, no se utilizaron en pandemia a pesar del clamor de potenciar 1er nivel de atención; los Hospitales colapsaron ante demanda insatisfecha!",NEG,NEU,-,NEG
1580,1.34623e+18,Encima q han destrozado la Salud la quieren usar para proselitismo político de la incapacidad de Morados!! https://t.co/CFElV5VyOI,NEG,NEU,-,NEG
1581,1.34546e+18,Sigue el maltrato de los Rojos del Partido Morado a @PoliciaPeru no solo los señalan culpables encima luego de extenuantes jornadas duermen en el suelo sin ninguna consideración y respeto. #MoradosNuncaMas https://t.co/8F0gsGBYUx,NEG,NEU,-,NEG
1582,1.34502e+18,"Atrás queda el 2020 donde la Bandera de gobernantes fue Incompetencia, locuacidad vacua, corrupción, mentiras,manejo desastroso de Pandemia con alta mortalidad. Ningún fenómeno Niño ni terrorismo hicieron tanto daño en tan poco tiempo!",NEG,NEG,pandemia,NEG
1583,1.36155e+18,"No era ni soy alto funcionario público, NO era tampoco candidato al Congreso ni pensaba serlo en ese momento, por lo que considero no cometí ningún acto irregular. Es muy injusto que se pretenda involucrar a Keiko Fujimori o Fuerza Popular con mi trabajo Médico",NEG,NEU,-,NEG
1584,1.36129e+18,Murió Carlos Saúl Menem quien traicionó vilmente a Peru vendiendo Armas a Ecuador en pleno conflicto siendo País garante. Esta herida permanece en Argentinos y Peruanos cuando recuerdan nuestro apoyo incondicional en Las Malvinas,NEG,NEU,-,NEG
1585,1.3595e+18,Remoción inmediata de Presidente JNE Jorge Luis Salas y su acólito Jovian Sanjinez!,NEG,NEU,-,NEG
1586,1.35933e+18,"Ricardo Uceda denuncia tremendo delincuencial cambiazo de votos en JNE para favorecer a Martín Vizcarra, todo fue manipulado, Corte Suprema debe cambiarlo y denunciarlo en el acto! https://t.co/ka4NdlhqRo",NEG,NEU,-,NEG
1587,1.35737e+18,"Muy fuerte aclaración Diplomática, NO es el transporte, sigue la mentira y el Verso! https://t.co/gbZzMGSN8C",NEG,NEU,-,NEG
1588,1.35713e+18,"La incapacidad del gobierno sigue causando frustración, desesperación y muerte; Señores si no hay vuelo comercial manden el avión Presidencial con su tanque auxiliar si no lo tiene Caletea pero llega bien y regresa. O no nos dicen la VERDAD y sigue el VERSO!",NEG,NEU,-,NEG
1589,1.37397e+18,"Tenemos que hacerle a ALTO a la politización de la Justicia, medidas abusivas y restrictivas hacia @KeikoFujimori tienen q ser suspendidas y continuar su campaña !!",NEG,NEU,-,NEG
1590,1.37261e+18,"Nuestras más sentidas condolencias a toda la familia de don Luis Bedoya Reyes, brillante Político y profesional fundador del PPC, guardó el recuerdo en mis retinas de su excelente discurso delante un sorprendido Dictador Velasco Alvarado en la plaza Castilla siendo Alcalde d Lima",NEG,NEU,-,NEG
1591,1.39526e+18,El trapo viejo de las “esterilizaciones forzadas” | EL MONTONERO https://t.co/CQHJisn0Il,NEG,NEU,-,NEG
1592,1.39113e+18,"Hoy día con muchísima pena y dolor lamentamos el fallecimiento de doña Maritza Mocarro Monja, gran dirigente de comedores populares y ex Consejera Regional en Lambayeque. Descansa en Paz querida Maritza siempre estarás en nuestros Corazones!",NEG,NEU,-,NEG
1593,1.38888e+18,"Vimos a un Pedro Castillo en su natal Chota, sin Ideas, sin reflejos con pobre elocución, reducido a su mínima expresión. El “Maestro” se quedó sí Cátedra, tiene mucho q aprender en cambio el “Sindicalista” fue solo protesta sin propuesta",NEG,NEU,-,NEG
1594,1.38888e+18,"@KeikoFujimori da propuestas lucha contra Pandemia, 40% de Cannon directamente a comunidades, Foncodes , Pronamach, Colegios todo a un Perú rural excluido sobre todo por gobernadores comunistas como Junín, Cajamarca, Cusco sentenciados por corrupcion ante silencio Pedro Castillo",NEG,NEU,-,NEG
1595,1.4095e+18,"Se desinfla reiterativa patraña de vladiaudios, acaso NO SABE Montesinos q esas llamadas son grabadas? NO saben su antagonismo visceral a Keiko, todo a sido armado convenientemente para manchar reclamo de saber la verdad #RespetamiVoto https://t.co/C3ZsCOPKlk",NEG,NEU,-,NEG
