,id,tweet,target,target_v,tema_v,target_final
875,1.39665e+18,"Vuelve a bajar el nivel. Bloque vivienda: FP/Preú Posible: El mismo discurso de techito en varios partidos. PL: Interesante enfoque territorial, pero una comunicación pobre. No creo que impacte en el curso del debate. Les pongo 0 en comunicación política de lo técnico a los dos.",NEG,NEU,-,NEU
876,1.39664e+18,"Bloque 3 Salud y Pandemia. FP. 0 propuesta y sin respuestas. PL. Cevallos: Impecable. Sólido en lo moral, en lo técnico y en lo político. ""FP no tiene autoridad moral, ni capacidad técnica"". ""No es solo anemia, es el hambre"". ""Sistema Único de Salud"" ""Salud como derecho""",NEG,NEG,politico,NEG
877,1.3966e+18,De Laura Bozzo a Chibolín... ¡30 años!,NEG,NEU,-,NEU
878,1.3965e+18,"""Estos datos confirman que la desigualdad se estaría tornando un problema más complejo de resolver y está en el trasfondo de la frustración de grandes segmentos de la población que exigen cambios radicales al percibir que poco tienen que perder."" https://t.co/oy1VrcZMvu",NEG,NEG,politico,NEG
879,1.39618e+18,"Es verdad, ¿Cómo es posible que le dejen gastar S/ 170 soles al candidado @PedroCastilloTe? Un verdadero abuso por parte de los partidarios del lápiz✏️✏️✏️✏️",NEG,NEG,politco,NEG
880,1.39572e+18,"COVID ha puesto de relieve las disparidades en la atención médica en EEUU. Pero muchos de los hospitales de la “red de seguridad”, cuya misión principal es servir a las comunidades de clase trabajadora de bajos ingresos, han estado en crisis durante años.",NEG,NEG,pandemia,NEG
881,1.39572e+18,"Cómo la presión para aumentar las ganancias y el apoyo gubernamental desigual están ampliando la brecha entre hospitales ricos y pobres, poniendo en peligro la atención de las poblaciones de bajos ingresos. #Covid19 https://t.co/xGqeMI2yWM",NEG,NEG,pandemia,NEG
882,1.39546e+18,"En Lima, (2da en Latino América y 15ta peor en el mundo), movilizarse en automóvil a la hora pico puede suponer un 42% más del tiempo que si no hubiera congestión vehicular. Durante la pandemia el tráfico se redujo en 15%. El daño a la salud es enorme. https://t.co/4p4i5ugLV7",NEG,NEG,pandemia,NEG
883,1.39497e+18,"¿Otro lamentable intento de aprovechamiento de la camiseta peruana? Me pongo ""la blanquiroja"" y me adelanto en la cola #vacunagate Vacunación de la selección peruana: Se habría dado un intento de aprovechamiento para inoculación https://t.co/CgsimW20It",NEG,NEG,pandemia,NEG
884,1.39461e+18,"Sr Presidente @FSagasti, Sra Primer Ministra @VBermudezV, Sr Min de Salud @ougarteu Sr Min de Educación @richicuenca El resto de América Latina ya empezó a vacunar a sus profesores, hagan una reserva para ellos. #COVID19 también es un problema social. #vacunenamiorofeya https://t.co/LWSB47HGnC",NEG,NEG,pandemia,NEG
885,1.39432e+18,"Perú requiere +/- 350,000 metros cúbicos de oxígeno diarios, y somos los únicos. El problema ha escalado de manera exponencial a nivel global. Hay escasez en el mercado mundial de tecnología para producir (plantas), distribuir, almacenar (balones) y seguridad (válvulas). #COVID19 https://t.co/4OB6kFYMcY",NEG,NEG,pandemia,NEG
886,1.39316e+18,"El exceso de fallecidos por #Covid_19, a nivel mundial, es entre 2,5 y 4,5 veces más que las cifras oficiales. @TheEconomist @rparrawong @javargashe @Cholega https://t.co/KmuqMralzV",NEG,NEG,pandemia,NEG
887,1.39304e+18,"La campaña, por acción de un lado y por inacción del otro, se hunde en un mar de mentiras. Esta es una de ellas. ¡Y repetida! Vuelvo a desmentir que participe, directa o indirectamente, en la formulación del plan de gobierno del Sr. Castillo. https://t.co/1wS8CkGi5l",NEG,NEG,pandemia,NEG
888,1.39297e+18,La pandemia nos revela como sociedad.,NEG,NEU,pandemia,NEU
889,1.39279e+18,"@AdrianzenEduard Lo único que prueba esto es que no hay tales ""libertarios"", ni ""demócratas"". Coincido contigo, ver a MVLl convertirse en geisha es de lo más penoso de esta campaña.",NEG,NEG,politico,NEG
890,1.40784e+18,América del Sur es el nuevo epicentro global de la pandemia.,NEG,NEG,pandemia,NEG
891,1.40784e+18,"Varios factores explican por qué: una vacunación lenta, nuevas variantes de Covid-19, ciudades abarrotadas, sistemas de salud débiles, tasas de obesidad mucho más altas que en África y Asia, inequidad y algunos gobiernos que en gran parte dejaron de intentar controlar el virus.",NEG,NEG,pandemia,NEG
892,1.40784e+18,"América del Sur tiene solo 5% de la pob. mundial, pero representa 25% de las muertes por #Covid_19 Casi un millón han muerto en 12 países de la región. Brasil ya superó las 500.000 y el virus mató 7 veces más personas per cápita cada día que en la India https://t.co/vgq43aGZ81",NEG,NEG,pandemia,NEG
893,1.40736e+18,"""La vorágine que se ha desatado nos asemeja más a una cárcel que a un país; donde cada bando político tiene una celda de la que sale muy poco para encontrar lugares comunes"". Jonathan Castro Opinion | Perú, un país encarcelado https://t.co/d34EwoxKPa",NEG,NEU,politco,NEU
894,1.40698e+18,"El ex Defensor del Pueblo y ex Decano de la Fac de Derecho de la Universidad Católica, Dr Walter Albán, dando cátedra en RPP y desbaratando los argumentos fujimoristas. ""mañana pedirán la partida de nacimiento de los votantes! Esto es un abuso"" #BastaYa https://t.co/noJA1XhJRN",NEG,NEU,-,NEU
895,1.40673e+18,"¡Basta ya! Editorializa hoy @larepublica_pe ""Sin mayores evidencias y con cada vez más pruebas que descartan el fraude, esperemos que la ciudadanía no se preste al juego y nos preparemos para recibir democráticamente los resultados oficiales"". https://t.co/yApSBvZH3G https://t.co/eWPlZ88IQn",NEG,NEG,politco,NEG
896,1.4205e+18,"La prensa internacional registra el vergonzoso momento en que prima la mezquindad política, negarle al saliente Presidente Sagasti no solo los honores correspondientes, sino el agradecimiento que le debemos por sus denodados esfuerzos por asegurar la vacunación para tods.",NEG,NEG,politco,NEG
897,1.4201e+18,"Pone el dedo en la llaga: las fracturas estructurales y las deudas históricas, al mismo tiempo que reconoce que ""el manejo que ha tenido el Perú ha sido un reflejo de lo que se puede hacer con lo poco que se tiene"".",NEG,NEG,politco,NEG
898,1.4195e+18,"Quitarle méritos a @ougarteu suena mezquino; más aún cuando deja una campaña de vacunación en pleno despliegue y con insumos garantizados. Toca a @HCevallosFlores mejorarlo: pagar deudas laborales, ampliar horarios, involucrar al ciudadano y a la responsabilidad de las empresas.",NEG,NEG,pandemia,NEG
899,1.41911e+18,"Me parece recordar que Alan García dictó está demagógica medida. Una forma eficaz de debilitar la gestión estatal y abrirle, aún más, el espacio a la corrupción.",NEG,NEG,politco,NEG
900,1.41877e+18,El científico que alimentó los bulos de la pandemia via @el_pais https://t.co/6NKCGMRf1U,NEG,NEG,pandemia,NEG
901,1.41874e+18,"Como este, hay muchos ejemplos de noticias falsas durante la pandemia. El Director de la OMS @DrTedros, considera que ""las fake news son un peligro para la seguridad de las personas"". Se considera que la pandemia, además de una emergencia de salud pública, lo es de comunicaciones",NEG,NEG,pandemia,NEG
902,1.41598e+18,"Como cambiar""hambre"" por ""necesidad básica insatisfecha"" ...",NEG,NEG,pandemia,NEG
903,1.41454e+18,"La de nunca acabar. Y no es solo España. Otros países europeos le siguen el paso, todos con mismo patrón: jóvenes, no vacunados, sin distanciamiento. España vuelve a encabezar los contagios de coronavirus en Europa via @el_pais https://t.co/JE286a5baG",NEG,NEG,pandemia,NEG
904,1.41348e+18,"Quinta ola en España. En los veinteañeros la incidencia acumulada ha alcanzado este jueves los 911 casos por 100.000 habitantes en 14 días, tres veces más que la media nacional Cómo frenar una ola distinta a todas las anteriores via @el_pais https://t.co/wQDtHqi82W",NEG,NEG,pandemia,NEG
905,1.41093e+18,"Como la Sra Aljovín fue ministra de RREE, dudé, así que revisé. Resultado, la afirmación de la señora es falsa. Ya lo dijo el ex presidente Obama “Si no podemos discriminar entre argumentos serios y propaganda, tenemos un problema”",NEG,NEU,-,NEU
906,1.43093e+18,"Páginas 8 y 16 del discurso del Premier Bellido. Una negación y el título de un párrafo. Sin una visión, sin una propuesta, una ruta, ni una meta. Una declaración vacía. https://t.co/a5U6cMmylq",NEG,NEU,-,NEU
907,1.42836e+18,"En México el retorno a clases presenciales gozaba de amplio apoyo de padres y madres de familia y de las y los docentes. Sin embargo, el proceso se considera ahora un fracaso. ¿Que falló? Aquí, 5 ex ministros de salud de México analizan el caso. Lecciones para el Perú.",NEG,NEU,-,NEU
908,1.4281e+18,El mercado mundial de vacunas está inestable por: 1. El rebrote en China ha impactado el abastecimiento global 2. Rusia no ha cumplido con entregar a tiempo la Sputnik afectando varios países de Am Latina 3. Los anuncios de 3ra dosis han incrementado los precios de Pfizer en 25%,NEG,NEG,pandemia,NEG
909,1.428e+18,"En la conferencia de la @OMS hoy, @DrTedros advirtió que ""la #DeltaVariant sigue superando nuestra respuesta colectiva #COVID19 y dentro de cada país los puntos calientes de hospitalización y muerte son donde hay bajos niveles de vacunación y medidas limitadas de salud pública"".",NEG,NEG,pandemia,NEG
910,1.44283e+18,"Sr Ministro de Salud @HCevallosFlores y Sr Ministro de Educación @araul_cl, urge revisar las bases de sus decisiones y acelerar el proceso de retorno a las aulas. No más niñs sin escuela en un país con presidente profesor. De ustedes depende.",NEG,NEG,pandemia,NEG
911,1.4412e+18,"SM @HCevallosFlores, creo que lo han inducido al error. Consulte a sus pares en América Latina. Estamos muy retrasados. Hernando Cevallos: ""No estamos en condiciones de este año reiniciar las clases escolares de manera global"" https://t.co/xFALwNfK4m a través de @RPPNoticias",NEG,NEG,pandemia,NEG
912,1.44053e+18,"Una de las 6 impactos negativos por las que hace meses venimos exigiendo el retorno a la escuela. 1) educación, 2)impacto sicológico, 3) nutricional [hambre y obesidad] 4) violencia (física y sexual), 5) habilidad social, 6) ingresos y autonomía de la mujer",NEG,NEG,pandemia,NEG
913,1.4405e+18,"Disminuir las hospitalizaciones contribuye, además, a reducir la saturación del sistema de salud, explica el exministro de Salud, Víctor Zamora.“cuando no te vacunas, se pone en riesgo al sistema [el peruano], que cuenta con la mitad de camas que necesita” https://t.co/OcuMEUSy00",NEG,NEG,pandemia,NEG
914,1.44013e+18,"Creo que tanto la periodista como el literato nos deben una disculpa y, en el caso de este último, su coanimadora debiera exigirselo, a menos, claro, que estas licencias sean permitidas solo en ciertos niveles. La agresividad contra @sigridbazan en esta conversa es inaceptable.",NEG,NEU,-,NEU
915,1.43904e+18,"Ya lo decía Julio Cotler en el 2011...""de repente no le quitan el patrimonio, ni la libertad, pero le quitan el estatus, lo que significa que dejan de acatarlos o respetarlos por tener un color o una posición"". El clasismo y racismo puro y duro de este personaje https://t.co/ROlM8qHvIq",NEG,NEU,-,NEU
916,1.43834e+18,"Mi solidaridad con el ex fiscal supremo Avelino Guillén, quien ha sido víctima de una cobarde agresión por parte de los militantes de la intolerancia; de aquellos que no conocen otro argumento más que el insulto y la violencia.",NEG,POS,politico,POS
917,1.43815e+18,"Sistemas precarios producto de décadas de abandono, políticas orientadas a la privatización de servicios esenciales, fragmentación de profundas raíces históricas, megatransiciones, han hecho que América Latina, y dentro de ella el Perú, sea el epicentro de la Pandemia.",NEG,NEG,pandemia,NEG
918,1.43775e+18,"No solo inexacta, sino poco profesional. En todos los procesos de retorno a las aulas se dan este tipo de casos, para lo cual debiéramos estar preparados. Estos casos hay que usarlos para aprender y mejorar. Por eso es piloto. @tvperupe @Minsa_Peru @MineduPeru",NEG,NEG,pandemia,NEG
919,1.43576e+18,"Barbacena llama la atención porque, en vez de enterrar la infamia perpetrada en nombre de la psiquiatría, las autoridades acordaron mirarla de frente. Convirtieron uno de los pabellones del Colonia en el Museo de la Locura https://t.co/xIijM6sIOM @EnConsultaPeru",NEG,NEG,pandemia,NEG
920,1.43565e+18,"A las rejas físicas se le suman las rejas mentales. No se les ocurre fomentar (pagar promotors culturales o deportivos, habilitar espacios de deporte o recreación)... no! Se finacia la represión, la reja, el candado. El problema no es plata, es mentalidad.😡 @Apazdelabarra",NEG,NEG,pandemia,NEG
921,1.43526e+18,"El retraso tecnológico del país es enorme, por ejemplo en producción de vacunas. El SPR anuncia la voluntad política de revertir esta situación vía un proyecto para producir la vacuna Sputnik en Perú. Sin conocer detalles, la mezquindad responde: ¡imposible!, ¡populista! https://t.co/hqjKR7Mgqz",NEG,NEG,pandemia,NEG
922,1.43473e+18,"""El sueño americano"" o la decadencia del sistema.",NEG,NEU,-,NEU
923,1.43401e+18,"""Decir que esa derecha es neoliberal es un mal uso de los conceptos. Sus actores se han camuflado como neoliberales porque así pretenden vestir de modernidad sus viejos intereses"" La derecha, más que bruta y achorada https://t.co/3fCHkRdfQk",NEG,NEG,politico,NEG
924,1.45458e+18,"Otor gobernador regional preso. No hay la menor duda que la estructura de gobiernos descentralizados debe ser reformado completamente; no para eliminarlos, si no para fortalecerlos. Lo que tenemos ahora es disfuncional.",NEG,NEG,politico,NEG
925,1.45417e+18,"🛑Igual que en Piura, el Dir. Reg. de Educación de San Martin, Sr Juan Vargas Rojas, muestra su ignorancia y su indolencia frente a la infancia. En @RPPNoticias ""explicando"" la decisión de cerrar las escuelas usando razones injustificadas y mitos. ¡Lamentable! @regionsanmartin",NEG,NEG,politico,NEG
926,1.45394e+18,"La preocupación radica en el hecho que, aunque se han colocado 34 millones de dosis, logrando proteger a más de 15 millones de peruanas y peruanos con las dosis completas, esto es el 55% de la población... aún falta la otra mitad. NO podemos bajar la guardia",NEG,NEG,pandemia,NEG
927,1.45334e+18,"Perú a la saga en el retorno a clases presenciales en Latinoamérica. El daño sicológico, físico, nutricional y social a nuestros niños, niñas y adolescentes es inmenso a lo que se suma el daño económico a las familias, especialmente a las mujeres. #COVID19",NEG,NEG,pandemia,NEG
928,1.45232e+18,Indolencia y complicidad.,NEG,NEG,pandemia,NEG
929,1.4523e+18,"Escuchando en @RPPNoticias al Director Regional de Educación de Piura, Sr Bonifaz.@Minsa_Peru y @MineduPeru debieran capacitar sobre COVID a las autoridades regionales. Sus argumentos para no regresar a la presencialidad son todos falaces y en base a estas toma de decisiones.",NEG,NEG,pandemia,NEG
930,1.45082e+18,"¿Te preocupa cómo estamos en la tabla de clasificación para el mundial de fútbol de Catar 2022? Miren esta tabla producida por @UNICEF. Perú, colero en la tabla de retorno al colegio en Sudamérica. @nb_correa @pablo_lavado @peruaclasesya @MineduPeru @Minsa_Peru @JaimeChincha https://t.co/SHHWQz3XMV",NEG,NEU,-,NEU
931,1.45062e+18,"Las grasas trans se consideran el peor tipo de grasa que se puede comer y son un problema doble para la salud del corazón. Las grasas trans aumentan el colesterol ""malo"" y reducen el ""bueno"". Jaime Delgado @jrdelgadoz señala los peligros de la decisión de @IndecopiOficial",NEG,NEG,pandemia,NEG
932,1.45023e+18,"La designación de Belmont disparó en mi memoria una magnífica expresión ""éramos pocos y parió la abuela"" 👎🏽",NEG,NEU,-,NEG
933,1.45021e+18,"Justo lo que necesitábamos como asesor del SPR @PedroCastilloTe. Alguien que esté en contra de la premier @MirtyVas, que negó la existencia de la pandemia #COVID19, está en contra de las mascarillas y la vacuna, además de sus posiciones homofóbicas y ultraconservadoras.",NEG,NEG,pandemia,NEG
934,1.4502e+18,"🆘Un retroceso inaceptable que atenta contra la salud pública de nuestro pueblo. Además de exigir que INDECOPI actúe, hay que hacerlo con el @Minsa_Peru que tiene la obligación de hacerlo. @HCevallosFlores @alexandro0953 @salud_derechos @EnConsultaPeru @MirtyVas @jjaimemiranda",NEG,NEG,pandemia,NEG
935,1.44915e+18,@arrunte5 Mis más sentidas condolencias.,NEG,NEU,-,NEG
936,1.44827e+18,"El fracaso de la humanidad en hacer de la vacuna un bien público global. Las instancias supranacionales basaron su accionar en la solidaridad y la filantropía; sin embargo, fue la lógica del lucro la que prevaleció. Mi artículo en @otramiradaperu https://t.co/UtDcgXPkun",NEG,NEG,pandemia,NEG
937,1.44826e+18,"Sería mezquino no reconocer el trabajo del Ministro de Salud @HCevallosFlores. No sólo no se ha detenido, si no que el ritmo de vacunación ha aumentado y la brecha en más vulnerables se va cerrando. El giro del enfoque ""Vamos a tu encuentro. Vacúnate ya!"" ha sido clave.",NEG,NEG,pandemia,NEG
938,1.44825e+18,"Obviamente, con estos precios, pasará como con la vacuna, los países pobres y de ingresos medios (Perú) no tendremos acceso o será limitado. La salud guiada por los estados financieros y la bolsa de valores y no por el bien público.",NEG,NEG,pandemia,NEG
939,1.4474e+18,Las tres olas de #Covid_19 en EEUU.,NEG,NEU,-,NEG
940,1.44726e+18,SPR @PedroCastilloTe Sra Presidenta del Consejo de Ministrs @MirtyVas no pueden seguir indolentes ante una situación de impacto negativo incalculable y que está en sus manos revertir. ¡No más niñs fuera del colegio en un país con presidente profesor! @HCevallosFlores,NEG,NEG,pandemia,NEG
941,1.44723e+18,"¿Quiénes impulsan estos polémicos cambios?, ¿Por qué ahora, pocas semanas antes de las elecciones del Colegio Médico? Cuestionados personajes detrás de esta iniciativa. Médics reclaman mayor transparencia, participación y postergación. Léalo en 👇🏾 https://t.co/eIxmHeF38h",NEG,NEG,pandemia,NEG
942,1.44701e+18,"🚑Aunque la capacidad ha mejorado, el abastecimiento de oxígeno sigue siendo insuficiente. Los mismos problemas desde el inicio de la #pandemia #Covid_19: regulación, fragmentación, capacidad técnica, RRHH, de producción, de distribución, gestión y corrupción. @Minsa_Peru",NEG,NEG,pandemia,NEG
943,1.4465e+18,"""Las pruebas moleculares que llevaron al hoy congresista morado a la palestra mediática todavía no ven la luz. Pese a recibir miles de soles en financiamiento del Concytec y empresas privadas, aún no hay expedientes presentados en la Digemid ni en el Instituto Nacional de Salud"".",NEG,NEG,pandemia,NEG
944,1.4465e+18,"La pandemia trajo un personaje muy singular. Vendió la idea que tenía un nuevo método diagnóstico para el #COVID19. Ganó reflectores, el apoyo del @Minsa_Peru e @INS_Peru, dinero público y privado; y, finalmente, una curul… aquí, la historia https://t.co/Wa6UDlXKA6",NEG,NEG,pandemia,NEG
945,1.44589e+18,Menú político cargado: 1. Nuevo gabinete 2. Se desinfla (esta) la arremetida vacadora 3. Se fractura la izquierda congresal. Pl reclamando su espacio en el ejecutivo.,NEG,NEG,politico,NEG
946,1.44434e+18,"Efectivamente @nb_correa. Una de las razones para el retorno a las aulas es que los hogares han perdido ingresos porque son las mujeres quiene dejan su trabajo para encargarse del cuidado. Pero las mujeres no solo pierden ingresos, también autonomía",NEG,NEG,pandemia,NEG
947,1.46466e+18,"Los vacunados pueden comer su cancha y tomar su gaseosa; los no vacunados, no. Los niños aquí si pueden entrar... Al colegio, ¡¡¡NI DE VAINAS!!! ¿De quién es la iniciativa? De PRODUCE. ¿Y el @MINSA? Dr. @HCevallosFlores! @MirtyVas https://t.co/a4oFExCIcC",NEG,NEG,pandemia,NEG
948,1.46466e+18,"@Minsa_Peru ¿Está esto permitido? No tiene ningún sentido. Luego, ¿Hay conciertos masivos de NO-vacunados?, ¿Estadios llenos de NO-vacunados?, ¿Colegios de NO-vacunados? @HCevallosFlores Obviamente, este es el resultado de una buena estrategia de ""influencia""",NEG,NEG,pandemia,NEG
949,1.46436e+18,"‼️Por eso, Sr Ministro, @HCevallosFlores, cuando el MINSA devuelve 1/3 parte de los fondos asignados para la compra de medicinas para el cáncer, genera muerte y pobreza. Es URGENTE implementar medidas para revertir está situación. Entre ellas el DL 1504 y DU 007/2019",NEG,NEG,pandemia,NEG
950,1.46421e+18,"Con esta forma de pensar, en el sector salud (igual de precario y en abandono por décadas), seguiríamos con 100 camas UCI, un solo laboratorio y no hubiésemos vacunado! Necesitamos un/a min de educación con compromiso, liderazgo y sentido de urgencia. @MirtyVas",NEG,NEG,pandemia,NEG
951,1.46396e+18,"A medida que avanza la vacunación #Covid_19, la urgencia de atender al precario y abandonado sistema de salud va perdiendo fuerza en la agenda. El ministro @HCevallosFlores vuelve a poner el dedo en la llaga: ""este presupuesto es solo para manejar la crisis"".",NEG,NEG,pandemia,NEG
952,1.46355e+18,"El país aprobó la Ley Nacional del Cáncer, su reglamente acaba de ser publicado y está en debate. Es paradójico que, a pesar de ello, los pacientes no tengan acceso a sus medicamentos porque no se han ejecutado todos los fondos disponibles. @drhuerta",NEG,NEG,pandemia,NEG
953,1.46355e+18,"Los pacientes oncológicos están entre los grandes afectados por la pandemia en Perú, habiendo bajado su atención hasta en 73% por sus efectos. Miles de ellos esperan sus tratamientos o se empobrecen al tener que comprarlos gastando de bolsillo o endeudándose.",NEG,NEG,pandemia,NEG
954,1.46355e+18,"🆘De los S/ 24 mill de soles destinados a la compra de medicamentos por parte del MINSA/CENARES, solo se han certificado S/ 15 mill, quedando casi 10 mills sin comprometer, A un mes de cerrar el año, corren el riesgo de ser devueltos. @mabel_huertas https://t.co/wBKynCp9Az",NEG,NEG,pandemia,NEG
955,1.47632e+18,"Si piensas leer algo sobre la pandemia, te recomiendo este artículo que se enfoca sobre algo más que el virus; trata sobre ""la frustración (que) llega con restricciones provocadas por la nueva variante y la duda de si la pandemia terminará algún día"". Se los recomiendo.",NEG,NEG,pandemia,NEG
956,1.47623e+18,"La abuela sale a la tienda. Al rato, regresa y para entrar toca el timbre. Mi hija de 3 años escucha y dice ""¡¡¡ahí trae el COVID!!!""....",NEG,NEU,pandemia,NEG
957,1.4762e+18,"🛑Si las necesidades de hospitalización y de cuidados intensivos fuese la mitad de lo requerido en el peor momento de nuestra segunda ola (abril 21), usando las cifras españolas, nuestro sistema de salud está en muy alto riesgo de colapso.",NEG,NEG,pandemia,NEG
958,1.4762e+18,"...como referencia. Perú tiene 77% con 2 dosis y +/- 10% con 3; las condiciones de vida, trabajo y transporte (que determinan el contagio), son peores en Perú; y, un sistema de salud precario, tanto para diagnóstico, como hospitalización (que condiciona la letalidad). 2/3",NEG,NEG,pandemia,NEG
959,1.47603e+18,"No me sorprende que el alcalde haga estas propuestas. Este tema no es de su especialidad y da muestras de desconocerlo y estar pésimamente asesorado. Lo que me sorprende es que el @MINSA, con todo su conocimiento y experiencia acumulada, le dé cabida.",NEG,NEG,pandemia,NEG
960,1.47598e+18,"Se requieren medidas eficaces y factibles. Sobre lo 1ro, AHORA ya sabemos sobre su limitada o nula eficacia. Sobre lo 2do, ¿tenemos la fuerza suficiente para controlar TODO el litoral, además de fiscalizar los verdaderos centros de contagio (fiestas, conciertos, etc)?",NEG,NEU,-,NEG
961,1.47581e+18,"""No mires arriba"" es justo eso. Que el absurdo y la estupidez es el verdadero esquema que rige los avatares de la humanidad. (tomado de este artículo de la revista Esquire). https://t.co/yHpAhnhgkU",NEG,NEU,-,NEG
962,1.47417e+18,"📢""si eres elegible y no te has vacunado, no solo eres un irresponsable, eres un idiota"". Tony Blair People who refuse to get Covid vaccine are ‘idiots’, Tony Blair says https://t.co/4E1uzZ5aLO",NEG,NEG,pandemia,NEG
963,1.47386e+18,"Bien censurado el ahora exministro Gallardo. Pero este resultado ya no es de los ministros, sino es de entera responsabilidad suya Sr Presidente @PedroCastilloTe. Más de 10 millones de niños, niñas, adolescentes y jóvenes últimos en las américas.",NEG,POS,politco,NEG
964,1.47344e+18,"Se veía venir. El Dr. Fauci, en Estados Unidos, aún no lo recomienda.",NEG,NEU,-,NEG
965,1.4729e+18,"Boric ""que no haya una salud para ricos y otra para pobres"".",NEG,NEU,-,NEG
966,1.47274e+18,"@Capacapo3 @oscardiazperu Felizmente es ""analista político"".",NEG,NEU,-,NEG
967,1.47186e+18,"""A mí me incomoda horriblemente un mundo en el cual la gente se grita en el pleno y se abraza en el pasillo. Yo eso no lo tolero. Cuando yo acuso a alguien de ser un delincuente o un ratero en público, no me abrazo en privado ni me pongo a chupar con él"" Javier Diez Canseco, 2012",NEG,NEU,-,NEG
968,1.47184e+18,"Al inicio de la pandemia, Alemania fue considerada un ejemplo en su control. ¿Q pasó?, ¿X q, 🇩🇪 enfrenta una situación tan grave en medio de la 4ta ola? Problemas políticos, regulatorios, logísticos, comerciales y hasta de organización de los servicios... https://t.co/9y24UcXn9X",NEG,NEG,pandemia,NEG
969,1.4686e+18,"La ""propuesta"" enarbolada por cierta derecha en el país tiene como columna vertebral el racismo y el clasismo puro y duro. Viven de espaldas al país; nacen y crecen es sus guetos; se sostienen en la exclusión.",NEG,NEG,politico,NEG
